{
  "version": 1,
  "command": "facts",
  "module": "main",
  "identity_scheme": "nauqtype.semantic.v1",
  "summary": {
    "modules": 2,
    "definitions": 6,
    "references": 9,
    "call_edges": 1
  },
  "modules": [
    {
      "id": "module:helper",
      "name": "helper"
    },
    {
      "id": "module:main",
      "name": "main"
    }
  ],
  "definitions": [
    {
      "id": "type:helper::Box",
      "kind": "type",
      "module": "helper",
      "name": "Box",
      "public": true,
      "span": { "start": 9 }
    },
    {
      "id": "fn:helper::make_box",
      "kind": "function",
      "module": "helper",
      "name": "make_box",
      "public": true,
      "span": { "start": 41 }
    },
    {
      "id": "fn:main::main",
      "kind": "function",
      "module": "main",
      "name": "main",
      "public": false,
      "span": { "start": 16 }
    },
    {
      "id": "field:helper::Box::value",
      "kind": "field",
      "module": "helper",
      "owner": "type:helper::Box",
      "name": "value",
      "type": "i32",
      "span": { "start": 19 }
    },
    {
      "id": "binding:fn:helper::make_box:1:value@50",
      "kind": "param",
      "module": "helper",
      "owner": "fn:helper::make_box",
      "name": "value",
      "scope_id": 1,
      "span": { "start": 50 }
    },
    {
      "id": "binding:fn:main::main:1:box@40",
      "kind": "local",
      "module": "main",
      "owner": "fn:main::main",
      "name": "box",
      "scope_id": 1,
      "span": { "start": 40 }
    }
  ],
  "references": [
    {
      "id": "use:main->helper@4",
      "kind": "import",
      "from": "module:main",
      "name": "helper",
      "target_kind": "module",
      "target_id": "module:helper",
      "span": { "start": 4 }
    },
    {
      "id": "typeref:helper::Box@26",
      "kind": "field_type",
      "from": "Box",
      "name": "i32",
      "target_kind": "builtin_type",
      "target_id": "builtin-type:i32",
      "span": { "start": 26 }
    },
    {
      "id": "typeref:helper::make_box@57",
      "kind": "param_type",
      "from": "make_box",
      "name": "i32",
      "target_kind": "builtin_type",
      "target_id": "builtin-type:i32",
      "span": { "start": 57 }
    },
    {
      "id": "typeref:helper::make_box@65",
      "kind": "return_type",
      "from": "make_box",
      "name": "Box",
      "target_kind": "type",
      "target_id": "type:helper::Box",
      "span": { "start": 65 }
    },
    {
      "id": "typeref:main::main@26",
      "kind": "return_type",
      "from": "main",
      "name": "i32",
      "target_kind": "builtin_type",
      "target_id": "builtin-type:i32",
      "span": { "start": 26 }
    },
    {
      "id": "nameref:helper::make_box@149",
      "kind": "struct_type",
      "from": "fn:helper::make_box",
      "name": "Box",
      "target_kind": "type",
      "target_id": "type:helper::Box",
      "span": { "start": 149 }
    },
    {
      "id": "nameref:helper::make_box@162",
      "kind": "value",
      "from": "fn:helper::make_box",
      "name": "value",
      "target_kind": "binding",
      "target_id": "binding:fn:helper::make_box:1:value@50",
      "span": { "start": 162 }
    },
    {
      "id": "nameref:main::main@46",
      "kind": "call",
      "from": "fn:main::main",
      "name": "make_box",
      "target_kind": "function",
      "target_id": "fn:helper::make_box",
      "span": { "start": 46 }
    },
    {
      "id": "nameref:main::main@71",
      "kind": "value",
      "from": "fn:main::main",
      "name": "box",
      "target_kind": "binding",
      "target_id": "binding:fn:main::main:1:box@40",
      "span": { "start": 71 }
    }
  ],
  "call_graph": [
    {
      "caller": "fn:main::main",
      "callee": "fn:helper::make_box",
      "call_site": "call:main::main@46"
    }
  ]
}
